{"type":"config","name":"Fraud Detection Model Optimization","metricName":"f1_fraud","metricUnit":"","bestDirection":"higher"}
{"run":1,"commit":"6456047","metric":0.783505,"metrics":{"precision_fraud":0.767677,"recall_fraud":0.8,"roc_auc":0.973103,"pr_auc":0.824553,"accuracy":0.99926,"train_time_s":3.065784,"infer_time_s":0.077739,"true_positives":76,"false_positives":23,"false_negatives":19,"true_negatives":56628},"status":"keep","description":"Baseline: XGBoost with scale_pos_weight, StandardScaler, n_estimators=200, max_depth=4, lr=0.1","timestamp":1780082983416,"segment":0,"confidence":null,"asi":{"hypothesis":"Baseline XGBoost with scale_pos_weight. Starting point for optimization.","model":"XGBoost","imbalance_handling":"scale_pos_weight","n_features":30}}
{"run":2,"commit":"6456047","metric":0.445682,"metrics":{"precision_fraud":0.30303,"recall_fraud":0.842105,"roc_auc":0.970941,"pr_auc":0.805169,"accuracy":0.996493,"train_time_s":5.686981,"infer_time_s":0.077876,"true_positives":80,"false_positives":184,"false_negatives":15,"true_negatives":56467},"status":"discard","description":"SMOTE oversampling: precision collapsed from 0.77 to 0.30, F1 dropped from 0.78 to 0.45","timestamp":1780083051240,"segment":0,"confidence":null,"asi":{"hypothesis":"SMOTE would improve minority class detection","rollback_reason":"SMOTE created too many false positives. The model learned to label everything as fraud. SMOTE generates synthetic fraud samples from only 378 real ones, creating unrealistic patterns.","next_action_hint":"Try threshold optimization instead — find optimal decision boundary for F1 maximization rather than resampling.","mode":"SMOTE oversampling"}}
{"run":3,"commit":"de37fbd","metric":0.836364,"metrics":{"precision_fraud":0.985714,"recall_fraud":0.726316,"roc_auc":0.965528,"pr_auc":0.808865,"accuracy":0.999524,"train_time_s":2.17835,"infer_time_s":0.038608,"true_positives":69,"false_positives":1,"false_negatives":26,"true_negatives":56650,"optimal_threshold":0.99},"status":"keep","description":"Added optimal threshold tuning on validation set: F1 0.78→0.84, precision 0.77→0.99","timestamp":1780083134336,"segment":0,"confidence":1,"asi":{"hypothesis":"Optimal threshold tuning on validation split would improve F1 by better balancing precision/recall","technique":"validation-based threshold optimization for F1","optimal_threshold":0.99,"insight":"With extreme imbalance, models output very low probabilities for fraud. The default 0.5 threshold is far too low — the optimal threshold is near the edge of the distribution at 0.99.","gain":"+6.7% F1"}}
{"run":4,"commit":"de37fbd","metric":0.829268,"metrics":{"precision_fraud":0.985507,"recall_fraud":0.715789,"roc_auc":0.970153,"pr_auc":0.808731,"accuracy":0.999507,"train_time_s":5.574723,"infer_time_s":0.062878,"true_positives":68,"false_positives":1,"false_negatives":27,"true_negatives":56650,"optimal_threshold":0.97},"status":"discard","description":"Deeper trees + doubled scale_pos_weight: F1 dropped 0.84→0.83, recall worsened to 0.72","timestamp":1780083211328,"segment":0,"confidence":2,"asi":{"hypothesis":"Deeper trees (max_depth 6) and 2x scale_pos_weight would improve recall","rollback_reason":"Both recall and F1 decreased. Deeper trees may have overfit on the small fraud sample. scale_pos_weight=ratio already well-calibrated.","next_action_hint":"Try feature engineering instead — interaction features between Amount and V features, or polynomial features."}}
{"run":5,"commit":"6dfc738","metric":0.850575,"metrics":{"precision_fraud":0.936709,"recall_fraud":0.778947,"roc_auc":0.963546,"pr_auc":0.824766,"accuracy":0.999542,"train_time_s":2.953778,"infer_time_s":0.025833,"true_positives":74,"false_positives":5,"false_negatives":21,"true_negatives":56646,"optimal_threshold":0.75},"status":"keep","description":"Feature engineering: Amount×V interactions, Amount_log, Amount², Time cyclical, Amount quantile. F1 0.84→0.85, recall 0.73→0.78","timestamp":1780083272487,"segment":0,"confidence":3.1477918055099297,"asi":{"hypothesis":"Interaction features between Amount and V-features would help the model identify fraud patterns involving transaction amount","technique":"Amount×V interactions, Amount transformations, Time cyclical encoding, Amount quantile","insight":"Feature engineering boosted recall from 0.73 to 0.78 while keeping precision at 0.94. Optimal threshold dropped from 0.99 to 0.75, suggesting the model now produces more discriminative probability scores. 36 new features added (28 interactions + 3 transforms + 2 time + 1 quantile + existing).","gain":"+1.7% F1 over threshold-optimized baseline"}}
{"run":6,"commit":"0c8d6d0","metric":0.862069,"metrics":{"precision_fraud":0.949367,"recall_fraud":0.789474,"roc_auc":0.951904,"pr_auc":0.835034,"accuracy":0.999577,"train_time_s":4.786386,"infer_time_s":0.034796,"true_positives":75,"false_positives":4,"false_negatives":20,"true_negatives":56647,"optimal_threshold":0.85},"status":"keep","description":"XGBoost + LogisticRegression ensemble (avg probabilities): F1 0.85→0.86, both precision & recall up","timestamp":1780083336092,"segment":0,"confidence":3.3422955841061883,"asi":{"hypothesis":"Ensemble of XGBoost + LogisticRegression would capture complementary patterns, improving both precision and recall","technique":"Average probability ensemble of XGBoost and LogisticRegression with class_weight=balanced","insight":"Logistic regression adds value even alongside XGBoost. Both precision and recall improved simultaneously, suggesting the models make different types of errors that cancel out in the ensemble. PR-AUC also improved from 0.825 to 0.835.","gain":"+1.1% F1, +0.9pp recall, +1.3pp precision"}}
{"run":7,"commit":"0c8d6d0","metric":0.862069,"metrics":{"precision_fraud":0.949367,"recall_fraud":0.789474,"roc_auc":0.951904,"pr_auc":0.835034,"accuracy":0.999577,"train_time_s":4.534754,"infer_time_s":0.035474,"true_positives":75,"false_positives":4,"false_negatives":20,"true_negatives":56647,"optimal_threshold":0.85,"ensemble_weight":0.5},"status":"discard","description":"Weighted ensemble optimization: confirmed W=0.5 optimal, no improvement over simple average","timestamp":1780083409391,"segment":0,"confidence":3.0563703559618767,"asi":{"hypothesis":"Learning optimal blend weight would improve over simple average ensemble","rollback_reason":"Grid search found 0.5 optimal — the simple average was already best. The two models' probability distributions are well-calibrated relative to each other.","next_action_hint":"Try LightGBM which has built-in imbalance handling, or add a third ensemble member like RandomForest."}}
{"run":8,"commit":"0c8d6d0","metric":0.842697,"metrics":{"precision_fraud":0.903614,"recall_fraud":0.789474,"roc_auc":0.95498,"pr_auc":0.815497,"accuracy":0.999507,"train_time_s":26.539378,"infer_time_s":0.10789,"true_positives":75,"false_positives":8,"false_negatives":20,"true_negatives":56643,"optimal_threshold":0.65,"ensemble_weight":-1},"status":"discard","description":"3-model ensemble (XGB+LR+RF): F1 dropped 0.862→0.843, RF adds noise and 8x slower training","timestamp":1780085186521,"segment":0,"confidence":4.678795819313337,"asi":{"hypothesis":"Adding RandomForest as 3rd ensemble member would improve diversity and F1","rollback_reason":"RF degraded the ensemble. Same recall as 2-model, worse precision (0.90 vs 0.95). RF is too correlated with XGBoost — they're both tree ensembles making similar errors. Training 8x slower.","next_action_hint":"Try calibrating probabilities with CalibratedClassifierCV, or try cross-validation for more robust threshold selection."}}
{"run":9,"commit":"0c8d6d0","metric":0.845714,"metrics":{"precision_fraud":0.925,"recall_fraud":0.778947,"roc_auc":0.9733,"pr_auc":0.833821,"accuracy":0.999524,"train_time_s":6.315196,"infer_time_s":0.073977,"true_positives":74,"false_positives":6,"false_negatives":21,"true_negatives":56645,"optimal_threshold":0.89,"ensemble_weight":0.5},"status":"discard","description":"5-fold CV for threshold: F1 dropped 0.862→0.846, CV threshold more conservative (0.89 vs 0.85)","timestamp":1780085395711,"segment":0,"confidence":5.850323925832141,"asi":{"hypothesis":"CV-based threshold selection would give more robust, generalizable threshold","rollback_reason":"CV found threshold 0.89 vs 0.85 single-split, increasing false positives and dropping F1. The single validation split threshold was actually better for this dataset. CV averages across folds with varying class ratios, diluting the signal.","next_action_hint":"Try F-beta threshold optimization (F2 to favor recall), or probability calibration."}}
